{
  "kind": "gpt_handoff.scm_pattern.binding",
  "spec_version": "0.1.3",
  "packet_id": "pkt-gpt-handoff-sidecar-001",
  "pattern_id": "scm.pattern",
  "route_id": "temporary-sidecar-definition-review",
  "authority_manifest_ref": "control/scm.pattern/authority.manifest.json",
  "realization_scope": {
    "allowed_surface": [
      "generated/packets/pkt-gpt-handoff-sidecar-001"
    ],
    "forbidden_surface": [
      "kernel-core authority paths",
      "separate plan artifact families",
      "separate implement artifact families"
    ],
    "realization_precondition": "Human approval with matching approval_basis_fingerprint"
  },
  "human_intervention_points": [
    "Review packet.definition.json and packet.definition.md for semantic correctness",
    "Issue packet.approval.json with a human approval verdict before any realization",
    "Reapprove after any semantic drift in the approval basis"
  ],
  "promotion_constraints": [
    "No promotion from definition review to realization without approval",
    "No closure without realization through scm.pattern",
    "Binding remains sidecar-only and removable"
  ],
  "repo_relative_packet_root": "generated/packets/pkt-gpt-handoff-sidecar-001",
  "notes": "This binding limits the packet to the local scm.pattern definition-review route and does not authorize implementation."
}
